question_number,theme,question,question_image,style,answer,answer_image,is_used,created_timestamp
1,design_research,How can we design sustainable design that responds to resource scarcity?,,,,,true,2025-08-25T03:07:45.905955
2,design_research,"The concept of generative design represents a fundamental shift in how we approach technological disruption. By integrating modular construction, designers can create solutions that are both environmentally friendly and beautiful. This approach emphasizes the importance of innovation in contemporary design practice, particularly when addressing coastal regions. The implementation of generative design requires careful consideration of budget constraints, ensuring that the final solution meets both functional and aesthetic requirements while contributing to carbon neutrality. This approach demonstrates how generative design can effectively address aging population in rural communities. The implementation of such solutions requires careful consideration of technical requirements to ensure successful outcomes.",,,"The concept of generative design represents a fundamental shift in how we approach technological disruption. By integrating modular construction, designers can create solutions that are both environmentally friendly and beautiful. This approach emphasizes the importance of innovation in contemporary design practice, particularly when addressing coastal regions. The implementation of generative design requires careful consideration of budget constraints, ensuring that the final solution meets both functional and aesthetic requirements while contributing to carbon neutrality. This approach demonstrates how generative design can effectively address aging population in rural communities. The implementation of such solutions requires careful consideration of technical requirements to ensure successful outcomes.",,false,2025-08-25T03:09:14.828934
3,technology_innovation,What role does sensors play in work?,,,,,true,2025-08-25T03:59:01.147001
4,technology_innovation,"sustainable design is revolutionizing engineering by enabling optimization that was previously impossible. This innovation addresses aging population through smart systems, creating new opportunities for economic growth. The key advantages include improved accuracy, lower maintenance, and quality improvement, which collectively transform how we approach communication. However, the implementation requires careful consideration of climate considerations, ensuring that the technology serves community engagement while maintaining performance benchmarks. This approach demonstrates how user-centered design can effectively address digital transformation in public spaces. The implementation of such solutions requires careful consideration of cultural context to ensure successful outcomes.",,,"sustainable design is revolutionizing engineering by enabling optimization that was previously impossible. This innovation addresses aging population through smart systems, creating new opportunities for economic growth. The key advantages include improved accuracy, lower maintenance, and quality improvement, which collectively transform how we approach communication. However, the implementation requires careful consideration of climate considerations, ensuring that the technology serves community engagement while maintaining performance benchmarks. This approach demonstrates how user-centered design can effectively address digital transformation in public spaces. The implementation of such solutions requires careful consideration of cultural context to ensure successful outcomes.",,false,2025-08-25T03:59:20.460957
5,technology_innovation,How can blockchain improve design?,,,,,true,2025-08-25T04:08:06.175752
6,technology_innovation,"The integration of machine learning in engineering represents a paradigm shift that enables visualization. This innovation addresses cultural diversity by providing lifecycle assessment, which leads to creativity. The technology's key features include adaptive responses, data-driven insights, and intelligent automation, making it particularly effective for healthcare facilities. Successful implementation depends on understanding climate considerations and ensuring that the technology aligns with zero waste while meeting industry best practices. This approach demonstrates how inclusive design can effectively address economic uncertainty in urban environments. The implementation of such solutions requires careful consideration of environmental conditions to ensure successful outcomes.",,,"The integration of machine learning in engineering represents a paradigm shift that enables visualization. This innovation addresses cultural diversity by providing lifecycle assessment, which leads to creativity. The technology's key features include adaptive responses, data-driven insights, and intelligent automation, making it particularly effective for healthcare facilities. Successful implementation depends on understanding climate considerations and ensuring that the technology aligns with zero waste while meeting industry best practices. This approach demonstrates how inclusive design can effectively address economic uncertainty in urban environments. The implementation of such solutions requires careful consideration of environmental conditions to ensure successful outcomes.",,false,2025-08-25T04:08:20.528402
7,spatial_design,What are the psychological effects of ergonomic layouts?,,,,,true,2025-08-25T04:08:36.105278
8,spatial_design,"Designing districts to enhance creativity requires understanding durability. This approach addresses aging population by implementing lifecycle assessment, which contributes to efficiency. The key considerations include maintenance requirements, sustainability goals, and technological integration, ensuring that the design is both flexible and practical. By focusing on cultural preservation, designers can create spaces that effectively enhance creativity. This approach demonstrates how generative design can effectively address technological disruption in residential neighborhoods. The implementation of such solutions requires careful consideration of material availability to ensure successful outcomes.",,,"Designing districts to enhance creativity requires understanding durability. This approach addresses aging population by implementing lifecycle assessment, which contributes to efficiency. The key considerations include maintenance requirements, sustainability goals, and technological integration, ensuring that the design is both flexible and practical. By focusing on cultural preservation, designers can create spaces that effectively enhance creativity. This approach demonstrates how generative design can effectively address technological disruption in residential neighborhoods. The implementation of such solutions requires careful consideration of material availability to ensure successful outcomes.",,false,2025-08-25T04:08:45.954220
9,urban_planning,What are the social benefits of transit-oriented development?,,,,,true,2025-08-25T04:13:49.131789
10,urban_planning,"The development of cultural venues in public spaces involves integrating sustainable design with sustainable design to achieve environmental sustainability. This approach addresses technological disruption through sustainable materials, resulting in productivity. The planning process requires geographic analysis, geographic appropriateness, and implementation strategy, which collectively determine durability. Successful implementation depends on understanding material availability and ensuring that the development contributes to cultural preservation. This approach demonstrates how resilient infrastructure can effectively address urban density in public spaces. The implementation of such solutions requires careful consideration of user needs to ensure successful outcomes.",,,"The development of cultural venues in public spaces involves integrating sustainable design with sustainable design to achieve environmental sustainability. This approach addresses technological disruption through sustainable materials, resulting in productivity. The planning process requires geographic analysis, geographic appropriateness, and implementation strategy, which collectively determine durability. Successful implementation depends on understanding material availability and ensuring that the development contributes to cultural preservation. This approach demonstrates how resilient infrastructure can effectively address urban density in public spaces. The implementation of such solutions requires careful consideration of user needs to ensure successful outcomes.",,false,2025-08-25T04:13:59.466080
